{
  "$schema": "https://json-schema.org/draft/2020-12/schema",
  "$id": "schema://frank.channel-content/v1",
  "title": "FRANK channel content",
  "description": "CH-01 (FRANK-§8E). Frank-owned, surface-neutral content posted to a channel surface. The surface renders it; it never defines, approves, or attests it. Actions on a card are proposals: durable resolution arrives through an inbound event plus a FRANK command envelope (ADR-022). No channel SDK type participates in this schema (FRANK-§6).",
  "type": "object",
  "additionalProperties": false,
  "required": [
    "schema",
    "contentId",
    "cellId",
    "roomId",
    "title",
    "blocks",
    "actions",
    "createdAt"
  ],
  "properties": {
    "schema": { "const": "frank.channel-content/v1" },
    "contentId": {
      "description": "Frank-side id for this content instance; doubles as the idempotency key for posting.",
      "type": "string",
      "minLength": 1
    },
    "cellId": {
      "description": "FRANK-§2.4. Every content instance is scoped to exactly one cell.",
      "type": "string",
      "minLength": 1
    },
    "roomId": {
      "description": "Frank room the content is associated with.",
      "type": "string",
      "minLength": 1
    },
    "workItemId": {
      "description": "FRANK work item the content is about, when it is about one.",
      "type": "string",
      "minLength": 1
    },
    "title": {
      "description": "Short human-facing heading.",
      "type": "string",
      "minLength": 1
    },
    "blocks": {
      "description": "Content blocks, in display order.",
      "type": "array",
      "items": { "$ref": "#/$defs/ChannelContentBlock" }
    },
    "actions": {
      "description": "Actions offered on the card; empty when the content is informational. A tap relays an inbound event; it does not decide (ADR-022).",
      "type": "array",
      "items": { "$ref": "#/$defs/ChannelAction" }
    },
    "createdAt": { "type": "string", "format": "date-time" }
  },
  "$defs": {
    "ChannelContentBlock": {
      "type": "object",
      "additionalProperties": false,
      "required": ["kind", "text"],
      "properties": {
        "kind": {
          "description": "v1 defines plain text blocks only; the envelope schema field pins the block set.",
          "enum": ["text"]
        },
        "text": { "type": "string" }
      }
    },
    "ChannelAction": {
      "type": "object",
      "additionalProperties": false,
      "required": ["actionId", "label", "verb", "targetObjectId", "targetObjectType"],
      "properties": {
        "actionId": { "type": "string", "minLength": 1 },
        "label": {
          "description": "Human-facing label.",
          "type": "string",
          "minLength": 1
        },
        "verb": {
          "description": "FRANK command verb the interaction proposes (e.g. 'ready', 'cancel').",
          "type": "string",
          "minLength": 1
        },
        "targetObjectId": { "type": "string", "minLength": 1 },
        "targetObjectType": { "type": "string", "minLength": 1 }
      }
    }
  }
}
