{
  "schema": "frank.channel-content/v1",
  "contentId": "cc-01J8Z4Q7M2K5R9T3V6X0B4N7C2",
  "cellId": "cell-steven-primary",
  "roomId": "room-roof-inspection",
  "workItemId": "wi-8842",
  "title": "Approve: share roof inspection folder",
  "blocks": [
    {
      "kind": "text",
      "text": "The roofer needs access to the shared inspection folder before Friday. Approving shares read-only access with the contractor account."
    },
    {
      "kind": "text",
      "text": "Next safe action: deny if you want to review the contractor's account first; nothing is shared until you approve."
    }
  ],
  "actions": [
    {
      "actionId": "act-approve-8842",
      "label": "Approve",
      "verb": "ready",
      "targetObjectId": "wi-8842",
      "targetObjectType": "work-item"
    },
    {
      "actionId": "act-deny-8842",
      "label": "Deny",
      "verb": "cancel",
      "targetObjectId": "wi-8842",
      "targetObjectType": "work-item"
    }
  ],
  "createdAt": "2026-08-06T18:22:41.510Z"
}
